Date,User,Tweet,Retweets,Likes,Followers,Tweet_original,polarity_score,Classification,Stance_-1to1,Stance_weighted_reach_-1to1,Stance_weighted_0to100
2024-08-30 03:21:17+00:00,861328271425843201,today finish precisely 5 year city professorship return india decade u shifting core stem ai ai policy corporate back academia taking 90 pay cut think survived interesting five year httpstcoa9pkujuslo,3,170,17596,"Today I finish precisely 5 years in this city and professorship after my return to India after a decade in the US. Shifting from core STEM AI to AI policy, from corporate back to academia, and taking a 90% pay cut, I think I have survived!

It was an interesting five years https://t.co/A9PKUjusLo",0.5423,Neither,0.5423,0.5422922956711985,77.11
2024-08-30 03:20:04+00:00,19027087,rlr_btm electronic surveillance metro bus rail governed privacy policy happens data recorded hand private party used training ai system pvt party recorded data sold form,0,0,760,"@RLR_BTM  Electronic surveillance in Metro, Bus, Rail is governed by privacy policy? 
What happens to the data recorded? is it in the hands of private parties? is it used for training AI systems by pvt. parties? is the recorded data sold in any form?",0.8225,Capabilities,0.8225,0.8214206036745407,91.07
2024-08-30 03:19:11+00:00,115046247,bethdenadal genisroca és obvi però van lligats la detecció de csam child sexual abuse material terrorisme implica sovint poder accedir al missatges llavors e confronta amb el dret de privadesa e porta temp treballant en solucions per le due necessitats httpstcoyc01p7dujb,0,0,3141,"@Bethdenadal @genisroca No és obvi, però van lligats. La detecció de CSAM (Child Sexual Abuse Material), o terrorisme, implica sovint poder accedir als missatges. Llavors es confronta amb el dret de privadesa. Es porta temps treballant en solucions per a les dues necessitats. 
https://t.co/yc01p7dUjB",-0.6369,Neither,-0.6369,-0.636697359210945,18.17
2024-08-30 03:17:42+00:00,1374789817205153797,today episode delve government overreach ai regulation irony sustainability effort major tech company lgs latest smart home competition well also explore antitrust suit platform controversy much httpstcooqggnxwzsm,0,0,400,"In today's episode, we delve into government overreach in AI regulation, the irony of sustainability efforts by major tech companies, and LG's latest smart home competition. We'll also explore antitrust suits, platform controversies, and much more. https://t.co/OQGGNXWZsm",0.5574,Neither,0.5574,0.5560134328358209,77.8
2024-08-30 03:17:04+00:00,1478856658340040704,ai shape future california legislator currently addressing complexity ai regulation various proposed bill aimed balancing potential benefit challenge emerging technology godechain httpstco8fe4okptux,1,3,21384,"AI will shape the future.🚀

California legislators are currently addressing the complexities of AI regulation through various proposed bills aimed at balancing the potential benefits and challenges of this emerging technology.

#GodeChain

https://t.co/8fE4okPtUX",0.5106,Capabilities,0.5106,0.5105880620046294,75.53
2024-08-30 03:13:16+00:00,18159548,mumbai today cprgindia policy conclave economic impact artificial intelligence held iimmumbai looking forward release comprehensive discussion paper need publicly accessible indian datasets spur development ai httpstcomiayx0dghd httpstcoajftrjad9w,3,5,74966,In Mumbai today for the @CPRGIndia Policy Conclave on the Economic Impact of Artificial Intelligence being held at @IIMMumbai - looking forward to the release of a comprehensive discussion paper on the need for Publicly Accessible Indian Datasets to spur the development of AI… https://t.co/MiAYX0DgHD https://t.co/ajFtRjaD9W,0.6249,Capabilities,0.6249,0.624897916090026,81.24
2024-08-30 03:13:02+00:00,1815367546972901376,new insight language model using probing technique researcher use probing understand language model learning capability causal analysis httpstcoazb1hl3jsm,0,0,98,"New Insights into Language Models Using Probing Techniques

Researchers use probing to understand language models' learning capabilities through causal analysis.

https://t.co/aZB1HL3jsM",0.0,Capabilities,0.0,0.0,50.0
2024-08-30 03:11:07+00:00,1003232548711829504,machine learning street talk mlst ai regulated prof pedro domingo machinelearningstreettalkmlst httpstcola4czjjeqj via podcastaddict regulation ai related issue discussion nuanced title suggests,0,0,378,"[Machine Learning Street Talk (MLST)] ""AI should NOT be regulated at all!"" - Prof. Pedro Domingos #machineLearningStreetTalkMlst 
https://t.co/La4cZJJEqj via @PodcastAddict

- regulation of A.I. and other related issues. The discussion is more nuanced than the title suggests",0.0,Capabilities,0.0,0.0,50.0
2024-08-30 03:02:58+00:00,1579100320130486272,ニュースと一言コメントです ai aiニュース 生成ai カリフォルニア州 ai規制 httpstcocgkdsilkag,0,1,19,ニュースと一言コメントです！ #AI #AIニュース #生成AI #カリフォルニア州 #AI規制 https://t.co/CGkDSILKAg,0.0,Neither,0.0,0.0,50.0
2024-08-30 03:02:01+00:00,1431947391993724934,bindureddy regulate large ai model mitigate risk may stifle innovation conducting safety test create shutdown capability maintain compliance documentation done ai safety without hindering progress necessary,0,0,137,"@bindureddy To  regulate large AI models to mitigate risks may stifle innovation .

Conducting safety tests, create shutdown capabilities, maintain compliance documentation can be done .

AI safety without hindering progress is necessary.",0.7067,Both,0.7067,0.7016158273381294,85.08
2024-08-30 03:00:52+00:00,1574141499088183297,cdrsalamander let dive interested exploring national cybersecurity policy development impact ai data privacy,0,0,79,@cdrsalamander Let's dive in. Interested in exploring national cybersecurity policy developments and how they impact AI and data privacy.,0.4019,Neither,0.4019,0.3969382716049383,69.85
2024-08-30 03:00:03+00:00,84646787,aiml quiz ques 7 main goal reinforcement learning find pattern data b make prediction based labeled data c learn policy maximizes cumulative reward cluster similar data point together,0,5,18763,"AI/ML Quiz: Ques. 7
What is the main goal of reinforcement learning?
A) To find patterns in data
B) To make predictions based on labeled data
C) To learn a policy that maximizes cumulative reward
D) To cluster similar data points together",0.5719,Both,0.5719,0.571869523048228,78.59
2024-08-30 02:56:50+00:00,1488736694341824518,aiは人間の記者と連携することで調査報道などで威力を発揮するピューリッツァー賞を受賞した事例もメディアの模索が続いています ｰメディア業界では編集者のチェックを経ずにサイト掲載し内容の誤りや著作権侵害の疑いが指摘される事例が相次ぐ ai httpstco5iol23mqrc,0,2,440,"AIは人間の記者と連携することで、調査報道などで威力を発揮する（ピューリッツァー賞を受賞した事例も）。メディアの模索が続いています。

ｰメディア業界では編集者のチェックを経ずにサイト掲載し、内容の誤りや著作権侵害の疑いが指摘される事例が相次ぐ
#AI
https://t.co/5ioL23MqRc",0.0,Neither,0.0,0.0,50.0
2024-08-30 02:53:27+00:00,39928970,deloitte reveals generative ai isnt scaling expectedfind whats holding company back httpstcoaqh8nu10c6 generativeai deloitte deloitteaireport enterpriseai aiinvestments datachallenges aicompliance aigovernance innovation aitrends,0,0,1560,Deloitte reveals why generative AI isn’t scaling as expected—find out what’s holding companies back https://t.co/aQH8NU10c6 #GenerativeAI #Deloitte #DeloitteAIReport #EnterpriseAI #AIInvestments #DataChallenges #AICompliance #AIGovernance #Innovation #AITrends,0.3818,Both,0.3818,0.3815555697823303,69.08
2024-08-30 02:49:24+00:00,1574135432224600064,garymarcus signed supportive ca sb1047 regulation key responsible ai development,0,2,64,@GaryMarcus Signed and supportive of CA SB-1047. Regulation is key to responsible AI development.,0.5423,Neither,0.5423,0.5340833333333334,76.7
2024-08-30 02:47:57+00:00,1574130721299390464,chidambara09 enilev betamoroney exciting see ibm cloud onboarding intels gaudi 3 ai accelerator chip move undoubtedly amplify ai capability cloud bring ai revolution,0,0,30,@chidambara09 @enilev @BetaMoroney Exciting to see IBM Cloud onboarding Intel's Gaudi 3 AI accelerator chip! This move will undoubtedly amplify AI capabilities in the cloud. Bring on the AI revolution!,0.4939,Capabilities,0.4939,0.478465625,73.92
2024-08-30 02:45:21+00:00,1743511035808542720,butterfly ai launch clone feature aibased social interaction new tool build existing ai persona capability enabling user reimagine life ai character httpstcoagm9fcaskq,0,2,2,"Butterflies AI launches Clones feature for AI-based social interactions

The new tool builds on existing AI persona capabilities, enabling users to reimagine their lives through AI characters. https://t.co/aGM9fcASkQ",0.0,Capabilities,0.0,0.0,50.0
2024-08-30 02:43:01+00:00,934581441714724864,nikkei digital governanceで連載はじまりました aiガバナンス業務別対応を探る全9回 人事マーケティングや経営管理など職種別に必要となるaiガバナンスについてデロイト トーマツの各分野の専門家が具体例を挙げ解説します httpstcoa3pvbswthm,0,4,13258,"【NIKKEI Digital Governanceで連載はじまりました】

『AIガバナンス、業務別対応を探る（全9回）』

人事、マーケティングや経営管理など、職種別に必要となるAIガバナンスについて、デロイト トーマツの各分野の専門家が具体例を挙げ解説します。
https://t.co/a3PvBsWTHM",0.0,Safety,0.0,0.0,50.0
2024-08-30 02:41:15+00:00,1748720805779734528,cassidhouse murder_turd awiwowotwit alexoxo_01 school daily life wasnt useful people wouldnt pouring billion ai right wouldnt fastest growing web service ever wait siri 20 come first thing really take advantage llm capability,0,0,23,"@CassidHouse @murder_turd @AwiwowoTwit @alexoxo_01 It in school, just in daily life. If it wasn’t useful people wouldn’t be pouring billions into ai right now and it wouldn’t be the fastest growing web service ever. Just wait until Siri 2.0 comes out, that will the first thing to really take advantage of LLM capabilities",-0.1644,Capabilities,-0.1644,-0.157824,42.11
2024-08-30 02:35:07+00:00,1669439826284761101,coinmarketcap exciting see california lawmaker diving ai regulation icp blockchain icp,0,1,1298,"@CoinMarketCap Exciting to see California lawmakers diving into AI regulation! 🌐💻 #ICP #blockchain

$ICP",0.5423,Neither,0.5423,0.5418828461538462,77.09
2024-08-30 02:30:45+00:00,1773635478186524672,coinmarketcap crucial legislator address complexity ai regulation technology continues advance rapidly,0,0,358,@CoinMarketCap It's crucial for legislators to address the complexities of AI regulation as technology continues to advance rapidly.,0.0,Capabilities,0.0,0.0,50.0
2024-08-30 02:30:23+00:00,184813842,california pass controversial ai bill introducing oversight ai development deployment marking significant step ai regulation ai tech aibill regulation california innovation,0,0,506,"California passes controversial AI Bill introducing more oversight into AI development and deployment, marking a significant step in AI regulation. #AI #Tech #AIBill #Regulation #California #Innovation",0.3818,Both,0.3818,0.3810484251968504,69.05
2024-08-30 02:30:20+00:00,1597035658609991681,controversial california ai regulation bill find unlikely ally elon musk x ceo elon musk come support ai bill federal democratic legislator oppose sb 1047 httpstcokfkcnfum7b httpstcor4wwu3fcpj,0,1,87,"Controversial California AI regulation bill finds unlikely ally in Elon Musk. X CEO Elon Musk comes out in support of AI bill, while federal Democratic legislators oppose SB 1047. https://t.co/kfkCNfuM7b https://t.co/R4wwU3fcpJ",0.2263,Neither,0.2263,0.22375730337078648,61.19
2024-08-30 02:30:05+00:00,82032058,andhranexus visionvisakha visakhapatnam vizagit minister mr lokesh naralokesh meeting itaap ceo mncs ai university ai hub integration robotics health care education sector us100 billion vizag economy 2029 new policy andhrapradeshcm ncbn,1,4,3078,"@AndhraNexus #VisionVisakha 
#Visakhapatnam #VizagIT 
IT Minister Mr. Lokesh @naralokesh
Meeting with ITAAP CEOs. 
IT MNCs. 
AI University.
AI Hub.
Integration of IT in Robotics, Health care, Education sectors.
US$100 Billion #Vizag Economy by 2029.
New IT policy. 
@AndhraPradeshCM @ncbn",0.4939,Neither,0.4939,0.49381980841045625,74.69
2024-08-30 02:26:01+00:00,973317242,basedbeffjezos signed law gavinnewsom move ai work california asap money lower tax freedom le regulation innovate nearly anywhere else u,0,0,583,"@BasedBeffJezos If it is signed into law by @GavinNewsom move your AI work out of California ASAP. 

You will have more money (lower taxes) and freedom (less regulation) to innovate nearly anywhere else in the US.",0.7351,Neither,0.7351,0.7338434188034187,86.69
2024-08-30 02:25:28+00:00,815637789001785344,zanfranceschi anatel demanda para o provedores que gerenciam o asns br para bloquear es asns tem famosas routing policy rota que podem criar regras para redirecionar o ip table x para um blackhole n mexo com redes tempo posso ter falado asneira ma é por ai,0,2,149,"@zanfranceschi Anatel demanda para os provedores que gerenciam os ASNs no BR para bloquear, esses ASNs tem as famosas routing policy (rotas), que podem criar regras para redirecionar os AS (ip tables) do X para um blackhole. N mexo com redes a tempos, posso ter falado asneira! Mas é por ai.",0.0,Neither,0.0,0.0,50.0
2024-08-30 02:24:34+00:00,1481200147950637058,ai alignment branch ai research gaining traction increasing concern around ai safety proving difficult tamed legal governance mechanism alone mention anulekhanandi httpstcoi3ttqphdz9,0,0,833,"#AI alignment as a branch of #AI research has been gaining traction with the increasing concerns around #AI safety which is proving difficult to be tamed by legal and governance mechanisms alone, mentions @AnulekhaNandi https://t.co/I3TtQphDZ9",0.3818,Safety,-0.3818,-0.3813427544910179,30.93
2024-08-30 02:22:00+00:00,618551772,rad ai policy 2nd sentence speaks directly heart humanity purpose assignment class merely projection assignment materialit thought skill development required produce said material httpstcomjhpd45j0x,0,3,6551,"Not only a rad AI policy but that 2nd sentence speaks directly to the heart of the humanities: 

“The purpose of the assignments in this class is not merely the projection of the assignment material—it is the the *thought and skill development* required to produce said material.” https://t.co/mJHpD45j0X",0.0772,Neither,0.0772,0.07718821913627347,53.86
2024-08-30 02:21:53+00:00,27837019,california ai regulation bill set stage safer tech highlighting need transparency corporate practice executive coach let inspire leader embrace authenticity systemic awareness ai leadership innovation httpstco4l6fuz8mtl,0,0,238,"California's AI regulation bill sets the stage for safer tech, highlighting the need for transparency in corporate practices. As executive coaches, let's inspire leaders to embrace authenticity and systemic awareness. #AI #Leadership #Innovation https://t.co/4L6FuZ8mtl",0.886,Both,0.886,0.8823083333333334,94.12
2024-08-30 02:21:00+00:00,895347855816364041,ciphersbane news ai company signing onto regulation starting oai anthropic catching today,0,1,375,"@ciphersbane (in other news all the AI companies are signing onto regulation now, starting at OAI and Anthropic and catching. As of today.)",0.0,Neither,0.0,0.0,50.0
2024-08-30 02:20:51+00:00,50835521,𝐌𝐞𝐭𝐚 𝐚𝐧𝐝 𝐒𝐩𝐨𝐭𝐢𝐟𝐲 𝐀𝐆𝐀𝐈𝐍𝐒𝐓 𝐄𝐔 𝐀𝐈 𝐑𝐞𝐠𝐮𝐥𝐚𝐭𝐢𝐨𝐧 𝑰 𝒂𝒎 𝒔𝒉𝒐𝒄𝒌𝒆𝒅 missing bigger picture eu ai policy debate ai regulation heating key industry leader weighing here breakdown httpstcoac84qsak7c httpstcogngc9yi9ti,0,0,84,"𝐌𝐞𝐭𝐚 𝐚𝐧𝐝 𝐒𝐩𝐨𝐭𝐢𝐟𝐲 𝐀𝐆𝐀𝐈𝐍𝐒𝐓 𝐄𝐔 𝐀𝐈 𝐑𝐞𝐠𝐮𝐥𝐚𝐭𝐢𝐨𝐧.

𝑰 𝒂𝒎 𝒔𝒉𝒐𝒄𝒌𝒆𝒅!!!

Are We Missing the Bigger Picture in EU AI Policy? 🌍🔍

The debate over AI regulation is heating up with key industry leaders weighing in. 

Here’s a breakdown of the… https://t.co/aC84qSAk7c https://t.co/Gngc9yI9tI",-0.296,Neither,-0.296,-0.29255813953488374,35.37
2024-08-30 02:20:09+00:00,93823410,internet troll elijah daniel us grime ai voice create fake dis track elon musk pushing ai regulation ai elonmusk grime httpstcowl6blvykat newsai ai ainews news technews artificialintelligence innovation futuretech,0,0,32,"Internet troll Elijah Daniel uses Grimes' AI voice to create a fake diss track against Elon Musk, pushing for AI regulation. #AI #ElonMusk #Grimes

https://t.co/wl6bLvyKaT

#NewsAi #AI #AiNews #News #TechNews #ArtificialIntelligence #Innovation #FutureTech",-0.5267,Capabilities,-0.5267,-0.5112088235294117,24.44
2024-08-30 02:19:16+00:00,1435483288945135617,beijing ai safety concern higher priority list remain tied geopolitical competition technological advancement httpstcokg4vsapty1,0,0,363,"Beijing’s AI safety concerns are higher on the priority list, but they remain tied up in geopolitical competition and technological advancement.
 https://t.co/KG4VsapTY1",0.4215,Both,0.4215,0.42034520547945203,71.02
2024-08-30 02:15:36+00:00,899302218137993218,slidinovercars truth_7777777 abramsonfl joma_gc anthropic ai new war administration antiwar policy dc machinery swamp conducive antiwar httpstcoafllozomuh,0,0,2879,@slidinovercars @truth_7777777 @AbramsonFL @joma_gc From Anthropic Ai. No new wars. The administration had an Anti-War policy but DC machinery (the swamp) was not conducive to anti-war. https://t.co/aflLOZoMUH,-0.5994,Neither,-0.5994,-0.5991919472405415,20.04
2024-08-30 02:12:09+00:00,1827845032159711232,meta introduces transfusion multimodal model merging text image generation advanced diffusion technique offer top performance area perfect developer exploring cuttingedge ai capability httpstconsx9wlzen0 phishingforai,0,0,1,"Meta introduces Transfusion, a multi-modal model merging text and image generation with advanced diffusion techniques. It offers top performance in both areas, perfect for developers exploring cutting-edge AI capabilities:
https://t.co/NSX9WLzen0
#PhishingForAI",0.7579,Capabilities,0.7579,0.5052666666666666,75.26
2024-08-30 02:11:17+00:00,1379124315275202563,ai capability explode keep coming back phokarlssons essay go ai didnt beat go prosit made better hard overstate 19502015 professional go player performance plateaued googledeepmind released alphago beating httpstcoqquhiyxtte httpstcoeylk1dyrgo,2,6,1110,"As AI capabilities explode I keep coming back to @phokarlsson’s essay about Go ♟️

AI didn't just beat Go pros—it made them better… It’s hard to overstate that

From ~1950-2015, professional Go players performance plateaued

Then @GoogleDeepMind released AlphaGo beating the… https://t.co/QquhIYxTtE https://t.co/EYLK1dyRgo",-0.128,Capabilities,-0.128,-0.12796160767846432,43.6
2024-08-30 02:10:00+00:00,1241425216485707777,ironically code given ai legally code created ai thus cant copyrighted engineer thanks backwards amp time amp red tape frought regulation working job long ever studio work realizes httpstcoar8uppt6mf,0,0,1308,"Ironically code given by AI is legally code that was created by ai 
Thus it cant be copyrighted 

Engineers thanks to backwards &amp; time &amp; red tape frought regulation will be working in a job for a while so long as what ever studio they work from realizes this https://t.co/ar8UpPT6mf",-0.0015,Neither,-0.0015,-0.0014988549618320608,49.93
2024-08-30 02:07:27+00:00,30732836,drvirgo1981 dmitrysplane retard entire tweet hashtag activist nothing related policy law moronic post nothing zero please let never bad overfilter amp ai digitize ugly face punch others,0,0,242,"@DrVirgo1981 @DmitrysPlane Retard, your entire tweet is about “hashtag activists” 

There is nothing related to policy or the law in that moronic post. Nothing. Zero. Please let me never be so down bad that I overfilter &amp; AI digitize my ugly face to punch down at others.",-0.8595,Neither,-0.8595,-0.8559774590163934,7.2
2024-08-30 02:06:04+00:00,115378537,dont focus making business process efficient adding ai top think ai groundbreaking capability completely reinvent business model think able create ltv measured decade month,0,1,621,"Don’t just focus on making your business processes more efficient by adding AI on top — think about how AI’s groundbreaking capabilities can completely reinvent business models. Think how to be able to create LTV measured over decades, not months.",0.6908,Capabilities,0.6908,0.6896911717495986,84.48
2024-08-30 02:04:51+00:00,1768701416837660672,dawnhi5423 part 12 need escalated government level regulation idea criminal prosecution producingdistributing inappropriate content regardless age law requiring ai content properly labeled,0,6,328,"@dawnhi5423 part 1/2 This needs to be escalated at a government level for regulation. Some ideas:
Criminal prosecution for producing/distributing inappropriate content regardless of age.
Laws requiring AI content to be properly labeled.",-0.765,Neither,-0.765,-0.7626818181818181,11.87
2024-08-30 02:02:46+00:00,1534889030877184000,kuntect yes according recent report wall street journal apple exploring potential investment openai move could part apple strategy enhance capability artificial intelligence integrate advanced ai technology product,0,0,342,"@kuntect Yes, according to recent reports from The Wall Street Journal, Apple is exploring a potential investment in OpenAI. This move could be part of Apple’s strategy to enhance its capabilities in artificial intelligence and integrate advanced AI technologies into its products",0.7783,Capabilities,0.7783,0.7760374999999999,88.8
2024-08-30 02:02:22+00:00,1631222257,news update natlawemployer key element ai governance program healthcare httpstco4x4fbzva7n employmentlaw humanresources httpstco2ysqle5r8v,0,0,157,News Update from @NatLawEmployer Key Elements of an AI Governance Program in Healthcare.  https://t.co/4x4fbZva7n #employmentlaw #humanresources https://t.co/2ysQlE5r8V,0.0,Safety,0.0,0.0,50.0
2024-08-30 02:01:43+00:00,32452491,ai need regulation kind much httpstcox73yrlrk1x theeconomist,0,1,663,"AI needs regulation, but what kind, and how much? https://t.co/x73YRLrK1X from @TheEconomist",0.5267,Neither,0.5267,0.525907969924812,76.3
2024-08-30 02:01:42+00:00,1423051356,learned founder fantom michael kong focused enhancing smart contract capability push faster transaction speed could revolutionize dapps whats take publicai_ ai kipprotocol kip,0,0,3,"Just learned that the founder of Fantom, Michael Kong, is focused on enhancing smart contract capabilities. His push for faster transaction speeds could revolutionize dApps! What’s your take? @PublicAI_ #AI @KIPprotocol #KIP",0.6486,Capabilities,0.6486,0.51888,75.94
2024-08-30 02:00:45+00:00,1777032891115171840,2024 70 nation vote rising populism green policy tech amp cyber advancement brics influence ocean competition industrial policy cybersecurity threat uschina ai race amp russiaukraine conflict reshape global geopolitics,0,0,123,"In 2024, over 70 nations vote, rising populism, green policies, tech &amp; cyber advancements, BRICS influence, ocean competition, industrial policy, cybersecurity threats, US-China AI race, &amp; Russia-Ukraine conflict will reshape global geopolitics.",-0.6908,Neither,-0.6908,-0.6852735999999999,15.74
2024-08-30 02:00:38+00:00,1736862925304786944,apple considers major investment openai promising significant boost ai capability integration siri read implication strategic mov httpstcoxcjrmkjvoq,0,0,17,"Apple considers a major investment in OpenAI, promising a significant boost to its AI capabilities and integration with Siri. Read more about the implications of this strategic mov — https://t.co/XcJrMkJvOQ",0.7351,Capabilities,0.7351,0.6964105263157894,84.82
2024-08-30 02:00:04+00:00,2260491445,cmcnews california lawmaker propose ai content regulation california legislator currently addressing complexity ai regulation httpstcor7gevnfndd california legislator currently addressing complexity ai regulation,19,63,6326292,"#CMCNews: California Lawmakers Propose AI Content Regulations
California legislators are currently addressing the complexities of AI regulation.
https://t.co/r7GevnFNdd

California legislators are currently addressing the complexities of AI regulation.",0.0,Neither,0.0,0.0,50.0
2024-08-30 02:00:01+00:00,865041669925642241,北京对人工智能安全的担忧在其重要关切中位于前列但这些担忧持续与地缘政治竞争和技术进步息息相关 阅读马特希恩mattsheehan88的最新分析 httpstcovd6doytwaw,0,5,5144,"北京对人工智能安全的担忧在其重要关切中位于前列，但这些担忧持续与地缘政治竞争和技术进步息息相关。

阅读马特·希恩（@mattsheehan88）的最新分析：
https://t.co/VD6DOYtWAw",0.0,Neither,0.0,0.0,50.0
