Date,User,Tweet,Retweets,Likes,Followers,Tweet_original,polarity_score,Classification,Stance_-1to1,Stance_weighted_reach_-1to1,Stance_weighted_0to100
2024-08-30 07:43:25+00:00,1100927498,also understand concern related misuse ai india also called creating global framework ethical use ai government making every necessary change policy level help fintech sector recently removed angel httpstcoea0gdrrh8a httpstcozzbgydsor5,6,14,3733511,I also understand your concerns related to misuse of AI. That is why India has also called for creating a global framework for the ethical use of AI. The government is making every necessary change at the policy level to help the FinTech sector. Recently we have removed the angel… https://t.co/eA0GDrrh8A https://t.co/ZzbGYDSOr5,0.802,Neither,0.802,0.8019999693126943,90.1
2024-08-30 07:42:58+00:00,1792132791586734080,rwa_hub hififinance daobase_ai ethereum combining fixedrate loan robust community governance offer secure predictable financial service,0,0,84,@RWA_HUB @HifiFinance @daobase_ai @ethereum combining fixed-rate loans with robust community governance to offer a secure and predictable financial service.,0.5859,Safety,-0.5859,-0.5790872093023256,21.05
2024-08-30 07:42:06+00:00,1511289006591467522,future splunk part cisco seems bright enhanced ai capability advanced security measure amp comprehensive observability solution see merger potential deliver unparalleled value amp set new standard forbes httpstcoat9rdmhdb7 httpstcoo5hplddep3,0,1,11,"The future of @Splunk, now part of @Cisco, seems bright with enhanced #AI capabilities, advanced #security measures &amp; comprehensive #observability solutions. See why our merger has the potential to deliver unparalleled value &amp; set new standards on @Forbes. https://t.co/at9RdmHdb7 https://t.co/O5HplDDep3",0.9001,Both,0.9001,0.8308615384615385,91.54
2024-08-30 07:39:06+00:00,824772144,announcing new capability coming vmware private ai foundation nvidia httpstco4tqtuha1hz httpstcodzuewktqcg,0,0,3984,Announcing New Capabilities Coming to VMware Private AI Foundation with NVIDIA https://t.co/4tQtUHA1HZ https://t.co/DzUEWkTqcG,0.0,Capabilities,0.0,0.0,50.0
2024-08-30 07:37:53+00:00,3053665303,california ai regulation bill get signed set global standard ai governance balancing safety innovationbut slow progress smaller firm ai dev go place le regulation ai technews innovation regulation california httpstconhbhcq8sh7,0,2,1705,"If California's AI regulation bill gets signed, it will set a global standard for AI governance! Balancing safety and innovation—but will slow down progress for smaller firms. AI dev will go to places with less regulation! 

#AI #TechNews #Innovation #Regulation #California https://t.co/NhbHcQ8sh7",0.802,Both,0.802,0.8015301698886936,90.08
2024-08-30 07:37:29+00:00,1372795550,ai arctic digital era fixing basic telecom policy security issue every tdh access phone no spam scam call roof trai failed miserably plug data spill dnd joke badi badi baatein karva lo ba httpstcoecnd4barsb,4,3,11091,"AI is the Arctic of the digital era. 
How about fixing basic telecom policy and security issues?
Every TDH has access to your phone nos. 

Spam and Scam calls are through the roof and TRAI has failed miserably to plug data spill.

DND is a joke.

Badi badi baatein karva lo bas https://t.co/ecnD4BArsb",-0.8807,Neither,-0.8807,-0.8806841203728748,5.97
2024-08-30 07:37:21+00:00,1757071115246284800,future ton capital trend watch sustainable investment growing emphasis environmental social governance esg factor techdriven venture investment ai blockchain cuttingedge technology brightutd httpstcoqjjz2tyurl,1,0,36,"The Future of Ton Capital: Trends to Watch**
   - **Sustainable Investments:** Growing emphasis on Environmental, Social, and Governance (ESG) factors.
   - **Tech-Driven Ventures:** Investments in AI, blockchain, and other cutting-edge technologies
@brightutd https://t.co/qJjZ2TYuRL",0.1779,Both,0.1779,0.175528,58.78
2024-08-30 07:36:55+00:00,718368960903847936,watch also understand concern related misuse ai india also called creating global framework ethical use ai government making every necessary change policy level help fintech sector recently removed httpstcofylhhrcnud httpstcojhcwjjbjgu,2,2,96465,#WATCH | I also understand your concerns related to misuse of AI. That is why India has also called for creating a global framework for the ethical use of AI. The government is making every necessary change at the policy level to help the FinTech sector. Recently we have removed… https://t.co/fylHHrcnUD https://t.co/jHcwjJBJGU,0.802,Neither,0.802,0.8019972287395603,90.1
2024-08-30 07:36:55+00:00,25053299,asked sustainability customer spending huang raved ai mindblowing capability httpstcodqq2zrynmo,0,2,2348746,"When asked about the sustainability of its customer spending, Huang raved about AI's mind-blowing capabilities. https://t.co/dqq2ZrynmO",0.0,Capabilities,0.0,0.0,50.0
2024-08-30 07:36:53+00:00,1287270219136880641,lillydancyger oed dont even know whether poet use computer write poem cuz like bad environment forced labor involved making computer gee think maybe according logic ai policy statement would advise u return paper,0,0,3055,"@lillydancyger @OED Now I don't even know whether poets should use computers to write poems cuz like it is bad for the environment and forced labor is involved in the making of computers. Gee, I think maybe, according to the logic of your AI Policy Statement, you would advise us to return to paper",-0.6124,Neither,-0.6124,-0.6121996728819105,19.39
2024-08-30 07:32:38+00:00,1801118000482770944,deputy prime minister lawrence wong announced ambitious plan advance ai capability secure critical resource foster ecosystem innovation responsible ai governance,0,0,39,"Deputy Prime Minister Lawrence Wong announced this ambitious plan to advance AI capabilities, secure critical resources, and foster an ecosystem of innovation and responsible AI governance.",0.7964,Both,0.7964,0.7769756097560976,88.85
2024-08-30 07:31:08+00:00,355989081,watch prime minister narendra modi say also understand concern related misuse ai india also called creating global framework ethical use ai government making every necessary change policy level help httpstcobpbllecjzy httpstcokcpvaubfuo,8,102,8440160,"#WATCH | Prime Minister Narendra Modi says, ""I also understand your concerns related to misuse of AI. That is why India has also called for creating a global framework for the ethical use of AI. The government is making every necessary change at the policy level to help the… https://t.co/bPBLLeCJZY https://t.co/KcpvAUbFuO",0.802,Neither,0.802,0.801999989442013,90.1
2024-08-30 07:30:33+00:00,1816735938438926336,wyoming mayoral candidate promised ai governance loses bigai bot politics didnt resonate voter ai politics election wyoming ainews httpstcoz3ttnoxlb7,0,0,7,Wyoming mayoral candidate who promised AI governance loses big—AI bot politics didn’t resonate with voters. #AI #Politics #Elections #Wyoming #AINews https://t.co/Z3Ttnoxlb7,0.0516,Safety,-0.0516,-0.04586666666666667,47.71
2024-08-30 07:30:32+00:00,1606402045589823499,openai new ai voice mode updated feature capability httpstcolhkniusioq,0,0,9,OpenAI New AI Voice Mode Updated Features and Capabilities https://t.co/LhKNiusiOq,0.0,Capabilities,0.0,0.0,50.0
2024-08-30 07:30:00+00:00,1822963292815478788,introducing eleven lab aipowered solution innovative texttospeech voice synthesis elevate audio experience eleven lab advanced capability creating natural voice content learn httpstcofeushw1fp6 ai texttospeech seven23ai httpstcoord9ztwjdw,0,0,1,"Introducing Eleven Labs, the AI-powered solution for innovative text-to-speech and voice synthesis. Elevate your audio experiences with Eleven Labs’ advanced capabilities for creating natural and voice content. 

Learn more: [https://t.co/feushw1Fp6] #AI #TextToSpeech #SEVEN23AI https://t.co/ORD9ZTWjdw",0.872,Capabilities,0.872,0.5813333333333333,79.07
2024-08-30 07:26:36+00:00,1742619188022132736,asknigerianews regulating use ai military especially partnership like usnigeria collaboration crucial technology evolves nature warfare balancing innovation responsible governance key ensuring ethical safe deployment technology,0,0,3,"@AskNigeriaNews Regulating the use of AI in the military, especially in partnerships like the US-Nigeria collaboration, is crucial as technology evolves the nature of warfare. Balancing innovation with responsible governance is key to ensuring ethical and safe deployment of these technologies.",0.9149,Both,0.9149,0.7319200000000001,86.6
2024-08-30 07:25:44+00:00,1287270219136880641,ahh know lillydancyger close reading ai policy statement phrase student caught using llm verb caught give police feeling closeread thesyllabus,0,0,3055,"Ahh, I know what it is @LillyDancyger (I am close reading your AI policy statement). It is your phrase ""any student caught using an LLM ..."" It is the verb ""caught"" that gives me the police feeling. #CloseRead #TheSyllabus",0.128,Neither,0.128,0.12795812888452732,56.4
2024-08-30 07:23:22+00:00,1697833658978099200,embrace future matrixainetworks drag leading charge decentralized ai governance,0,0,533,🤖 Embrace the future with @MatrixAINetwork's dRAG. Leading the charge in decentralized AI governance.,0.1027,Both,0.1027,0.10250803738317758,55.13
2024-08-30 07:23:08+00:00,15743052,udoeffies mozo_xyz моzо intrigue unique ai capability offer user data protected web3,0,0,6304,@udoeffies @Mozo_xyz Моzо intrigues. What unique AI capabilities does it offer? How is user data protected in Web3?,0.4404,Capabilities,0.4404,0.4403301617507136,72.02
2024-08-30 07:22:41+00:00,10507282,internet troll elijah daniel enlists grime ai piss elon push regulation httpstcovtx9to3b6l via rollingstone,0,0,2738,Internet Troll Elijah Daniel Enlists Grimes AI to Piss Elon Off and Push for Regulation https://t.co/vTx9tO3B6L via @RollingStone,-0.6369,Neither,-0.6369,-0.6366675547445255,18.17
2024-08-30 07:22:33+00:00,24442348,week tenuityairoundup metas llama 3 go opensource democratize ai rising ai training cost spotlight efficiency gpt4 78m amp gemini ultra 191m eu ai act reshapes regulation ibm boost ai accessibility legal battle ai amp ip httpstcoika8yfgq95,0,0,415,"🚀 In this week's #TenuityAIRoundup: Meta's Llama 3 goes open-source to democratize AI! 💡 Rising AI training costs spotlight efficiency, with GPT-4 at $78M &amp; Gemini Ultra at $191M. EU's AI Act reshapes regulation, while IBM boosts AI accessibility. 🏛️ Legal battles over AI &amp; IP… https://t.co/Ika8yFGq95",0.4767,Capabilities,0.4767,0.4755568345323741,73.78
2024-08-30 07:22:03+00:00,915580080432148482,sebkrier agreed great idea feel like theyre much scope suggestion thats covered political capital ai regulation specifically say im unsure lowcost aispecific intervention yield 2x policymakers,0,0,139,"@sebkrier Agreed, those are great ideas - I just feel like they're much further from the scope of suggestion that's covered by the political capital for AI regulation specifically? Which is to say: I'm very unsure there are low-cost, AI-specific interventions that yield 2x policymakers.",0.7717,Neither,0.7717,0.76622695035461,88.31
2024-08-30 07:21:52+00:00,15743052,ravishkabandar3 impressive growth considered ai potential societal impact beyond technical capability,0,0,6304,@RavishkaBandar3 Impressive growth! Have we considered AI's potential societal impacts beyond technical capabilities?,0.7096,Capabilities,0.7096,0.709487472248652,85.47
2024-08-30 07:21:50+00:00,1794908497110609920,puni1992 thats great hear actually developing ai presentation tool integrated ai search capability interesting see different tool enhance productivity ill definitely check findrthanks recommendation,0,1,58,@puni1992 That’s great to hear! We’re actually developing an AI presentation tool with integrated AI search capabilities ourselves. It’s interesting to see how different tools can enhance productivity. I’ll definitely check out Findr—thanks for the recommendation!,0.7717,Capabilities,0.7717,0.7588383333333334,87.94
2024-08-30 07:19:08+00:00,1785233898646953984,california ai regulation bill headed governor desk httpstcozlje566mc6 future responsible tech could hold back innovation next move crucial ai technews innovation regulation california airegulation,0,2,132,"🚨 California's AI regulation bill is headed to the governor's desk! 🧠💡
https://t.co/Zlje566mC6
Will this be the future of responsible tech, or could it hold back innovation? The next move is crucial. 🤔

#AI #TechNews #Innovation #Regulation #California #AIRegulation",0.7579,Capabilities,0.7579,0.7522440298507462,87.61
2024-08-30 07:17:30+00:00,1828088256044339200,exciting news metas ai assistant gained million user contest chatgpt showing powerful capability natural language processing battle ai assistant heating meta ai chatgpt technology innovation,0,0,3,"""Exciting news! Meta's AI Assistant has gained millions of users in a contest against ChatGPT, showing its powerful capabilities in natural language processing. The battle of AI assistants is heating up! #Meta #AI #ChatGPT #Technology #Innovation""",0.8779,Capabilities,0.8779,0.70232,85.12
2024-08-30 07:10:44+00:00,3016357837,openai aim release new ai model strawberry fall openai reportedly aim release nextlevel artificial intelligence product fall product called strawberry able solve problem task beyond capability current ai httpstcoagie9etg9u httpstcooh3mn2y7ad,0,0,12855,"📣 OpenAI Aims to Release New AI Model, ‘Strawberry,’ in Fall

OpenAI reportedly aims to release its next-level artificial intelligence product in the fall. The product, called “Strawberry,” will be able to solve problems and tasks that are beyond the capabilities of current AI… https://t.co/AGiE9ETG9U https://t.co/oH3mn2Y7ad",0.296,Capabilities,0.296,0.29597697752197244,64.8
2024-08-30 07:06:36+00:00,1798706639274659840,andrewcurran_ either u see ai critical tool need control model impactful regulation necessary manage societal effect,0,1,297,"@AndrewCurran_ Either the U.S. sees AI as a critical tool they need to control, or the models are so impactful that regulation is necessary to manage their societal effects.",-0.3182,Capabilities,-0.3182,-0.31713578595317726,34.14
2024-08-30 07:06:14+00:00,1457995649681661962,ai_blockparty absolutely agree combination ai blockchain gamechanging decentralized nature blockchain ensures transparency fairness ai brings powerful automation decisionmaking capability fet leading way merging technology,0,0,234,"@ai_blockparty Absolutely agree! The combination of AI and blockchain is game-changing. The decentralized nature of blockchain ensures transparency and fairness, while AI brings powerful automation and decision-making capabilities. $FET is leading the way by merging these technologies🙌",0.6801,Both,0.6801,0.6772182203389832,83.86
2024-08-30 07:05:30+00:00,376207822,tech leader call action adapt ai strategy align groundbreaking regulation future ai let shape responsibly ai aigovernance innovation ethicalai eulaw httpstcox9tilkxnei httpstcoisdqtpdnpy,0,0,82,"For tech leaders, this is a call to action: How will you adapt your AI strategies to align with these groundbreaking regulations? The future of AI is here - let's shape it responsibly.

#AI #AIGovernance #Innovation #EthicalAI #EULaw  https://t.co/x9TIlKXNei https://t.co/IsdQtpdNPY",0.3818,Both,0.3818,0.37725476190476187,68.86
2024-08-30 07:03:41+00:00,1775102308306792448,66 regulation 1 reward limitation account claim newbie reward cannot claim multiple time 2 content review submitted tweet undergo ai quality relevance check ensure meet platform standard entering ai httpstcovkcpwtwcq1,0,0,2686,"🧵 [6/6]

📖 Regulation
1️⃣ Reward Limitation: Each account can only claim the newbie reward once and cannot claim it multiple times.
2️⃣ Content Review: Submitted tweets will undergo AI quality and relevance checks to ensure they meet platform standards before entering the AI… https://t.co/VKCPWTwcQ1",0.8316,Safety,-0.8316,-0.831290625,8.44
2024-08-30 07:02:26+00:00,1805402644271579138,rwa_hub hififinance daobase_ai ethereum platform communitydriven governance model enhances security predictability offering reliable transparent financial service user,0,0,49,"@RWA_HUB @HifiFinance @daobase_ai @ethereum The platform's community-driven governance model enhances security and predictability, offering a reliable and transparent financial service for all users.",0.34,Both,0.34,0.33333333333333337,66.67
2024-08-30 07:01:01+00:00,256188730,ever wondered ai shaping future uk government humble beginning role transforming policymaking weve explored incredible journey ai governance curious know read full blog httpstcouqntvrbulo ai government httpstcou54awylstk,0,0,120,"Ever wondered how AI is shaping the future of the UK government?
From its humble beginnings to its role in transforming policy-making, we've explored the incredible journey of AI in governance.
Curious to know more?
Read the full blog now: https://t.co/UqntvRbuLO 
#AI #Government https://t.co/u54awylSTk",0.3182,Both,0.3182,0.3155918032786885,65.78
2024-08-30 07:00:44+00:00,72276399,zero1_labs launched 2 million deai community program opencampaign zero1 lab zero1 lab forefront merging decentralized data governance ownership cuttingedge world ai dynamic team belief creating innovative httpstcof4a3mmgq7h,0,0,1864,"@Zero1_Labs has launched the $2 Million $DEAI Community Program #opencampaign 

About Zero1 Labs
Zero1 Labs is at the forefront of merging decentralized data governance and ownership with the cutting-edge world of AI.

We're a dynamic team that believes in creating innovative… https://t.co/f4a3MMgq7h",0.802,Both,0.802,0.8015702036441585,90.08
2024-08-30 07:00:11+00:00,1740114520587280384,keep eye new platform rewarding token holder airdrop participating governance vote great way engage community voting publicai_ ai kipprotocol kip,0,0,43,Keep an eye out! 🎯 A new platform is rewarding token holders with airdrops for participating in governance votes. It’s such a great way to engage the community! Are you voting? @PublicAI_ #AI @KIPprotocol #KIP,0.872,Both,0.872,0.8526222222222222,92.63
2024-08-30 06:58:41+00:00,552010482,experience new dimension ai matrix token drive matrix one ecosystem crafting unique ai character participating governance matrix give power shape decentralized innovative digital world matrixoneai,6,4,6450,"Experience a new dimension of AI with $MATRIX, the token that drives the Matrix One ecosystem. From crafting unique AI characters to participating in governance, $MATRIX gives you the power to shape a more decentralized and innovative digital world.

@MatrixOneAI",0.4404,Both,0.4404,0.44039024757518047,72.02
2024-08-30 06:56:19+00:00,1617375623739068417,dfinity 37 hyped imagine building dapps ai capability baked right running onchain relying centralized ai service developer open whole new world possibility web3 blockchainai,0,0,152,"@dfinity 3/7 Why am I so hyped? Imagine building dApps with AI capabilities baked right in, all running on-chain. No more relying on centralized AI services. As a developer, this opens up a whole new world of possibilities! #Web3 #BlockchainAI",0.0,Capabilities,0.0,0.0,50.0
2024-08-30 06:53:56+00:00,1793914498442571776,capability artificial intelligence generative ai grow finance leader best positioned take charge technology create value new way hear expert mit amp stanford view technology game changer teamwday httpstco83vv0bsok9 httpstcozhk8kbiha3,0,0,0,"As the capabilities of artificial intelligence and generative AI grow, finance leaders are best positioned to take charge of the technology to create value in new ways. Hear how experts from MIT &amp; Stanford view the technology as a game changer.  #TeamWDAY https://t.co/83vV0Bsok9 https://t.co/Zhk8KbiHa3",0.8957,Capabilities,0.8957,0.44785,72.39
2024-08-30 06:50:01+00:00,1066494605020094464,matrixoneai making ai humanlike technical capability also instilling empathy creativity sense morality truly program machine heart soul matrix earthquake cristianoronaldo 온우주가말해_규빈아_생일축하해 httpstcoksfjwvx49d,0,0,1307,"@matrixoneai
Making AI human-like is not just about technical capabilities, but also about instilling empathy, creativity, and a sense of morality - can we truly program a machine to have a heart and soul?
$MATRIX
🧑‍💻
#earthquake #CristianoRonaldo #온우주가말해_규빈아_생일축하해 https://t.co/ksFJWVX49D",0.6705,Capabilities,0.6705,0.6699877769289534,83.5
2024-08-30 06:45:01+00:00,4241031461,ai impact governance risk compliance program gt httpstcotzvr79fc74 business leader leadership management grc risk riskmanagement ciso cio cto ceo cro tech artificialintelligence genai generativeai cybersecurity automation httpstcouwmv83aqgi,4,3,3308,"How #AI Will Impact #Governance, Risk And #Compliance Programs &gt; https://t.co/tZvR79fC74 

#business #leaders #leadership #management #GRC #risk #riskmanagement #CISO #CIO #CTO #CEO #CRO #tech #ArtificialIntelligence #genAI #generativeAI #cybersecurity #automation https://t.co/UWmV83AQGI",-0.2732,Both,-0.2732,-0.27318348845642454,36.34
2024-08-30 06:44:26+00:00,385428477,whatsapps meta ai chatbot get voice chat upgrade whatsapps meta ai chatbot getting voice chat upgrade making interactive accessible addition build chatbots current capability aiming make powerful ai assistant directly within httpstcoahg4vzmy6v httpstcoyrpluhacuq,0,1,718,"WhatsApp's Meta AI Chatbot Gets Voice Chat Upgrade

WhatsApp's Meta AI chatbot is getting a voice chat upgrade, making it more interactive and accessible. This addition builds on the chatbot's current capabilities, aiming to make it a powerful AI assistant directly within… https://t.co/ahg4vzMY6V https://t.co/yRpluHACuq",0.4215,Capabilities,0.4215,0.4209145833333333,71.05
2024-08-30 06:44:12+00:00,215329519,courtesy call m merve hickok founder httpstcomfeph2gton globally renowned expert ai policy ethic governance education human right ununiversity httpstcoaxua2ezzk8,1,21,37083,"Courtesy call by Ms. Merve Hickok the founder of https://t.co/mfEpH2gTON and a globally renowned expert on AI policy, ethics and governance. Education is a human right! @UNUniversity https://t.co/axua2ezzk8",0.3612,Safety,-0.3612,-0.36119513004085263,31.94
2024-08-30 06:43:04+00:00,1539701866702970881,uominetwork next big thing ai looked tokenomics found uomi network issue total 21 billion token 49 billion preminted kickstart liquidity support governance dao meet staking need node operation httpstcovz5f5fvxc0,1,4,3254,"@UomiNetwork is the next big thing in #AI 🚀

I looked into its tokenomics and found that #UOMI Network will issue a total of 21 billion tokens

Of these, 4.9 billion will be pre-minted to kickstart liquidity, support the governance DAO, and meet staking needs for node operations https://t.co/VZ5f5fVxc0",0.4019,Both,0.4019,0.4018382736906773,70.09
2024-08-30 06:42:13+00:00,1815098402700681217,literally harris job regulate shit bed wild wild west ai already developed regulation genie bottle woman need destroyed httpstcolj2zjrr3dm,0,0,30,This was literally Harris's job to regulate and she shits the bed once again. Its the wild wild west out there for AI that has already been developed with no regulation. The Genie is out of the bottle - this woman needs to be destroyed. https://t.co/Lj2ZjrR3DM,-0.7783,Neither,-0.7783,-0.7539781249999999,12.3
2024-08-30 06:42:04+00:00,21297794,california advance landmark legislation regulate large ai model artificial intelligence ai httpstco4tz5ftbry9,0,0,7103,California advances landmark legislation to regulate large AI models | Artificial intelligence (AI) https://t.co/4tZ5FTbRY9,0.5267,Capabilities,0.5267,0.5266258691062632,76.33
2024-08-30 06:40:39+00:00,37945701,goal develop system performs task also evolves enhances capability autonomously mimicking natural evolution intelligence aigarth aim introduce new paradigm ai development leveraging foundational principle httpstcoehsuraved1 httpstcobveovn3lrb,2,11,10600,"The goal is to develop a system that not only performs tasks but also evolves and enhances its capabilities autonomously, mimicking the natural evolution of intelligence.

Aigarth aims to introduce a new paradigm in AI development while leveraging the foundational principles of… https://t.co/EHSuraved1 https://t.co/BVEoVn3Lrb",0.6808,Capabilities,0.6808,0.6807785938875613,84.04
2024-08-30 06:38:37+00:00,114561606,btw live nantes join next genai meetup september 18 xavier meta explain added multimodal capability llama3 httpstcopsoaekvykp httpstcot6rpjzas75,3,2,1095,"🇫🇷 BTW, if you live in Nantes, join our next GenAI meetup (September 18).

Xavier (Meta) will explain how they added multi-modal capabilities to Llama3.

https://t.co/pSoaeKVyKp https://t.co/t6RpJZas75",0.296,Capabilities,0.296,0.29593249714937286,64.8
2024-08-30 06:36:49+00:00,945231009792102400,charles_mcghee_ bitcoins elonmusk youre obviously ignorant dumb ai producing answer search fact ask fact think act capability know enough hurt others charles,0,1,96,@Charles_McGhee_ @bitcoins @elonmusk You’re obviously ignorant and dumb. AI is not producing the answer but searches for facts if you ask for facts. We all think and act to our capabilities. Most only know enough to hurt themselves and others. Charles.,-0.8316,Capabilities,-0.8316,-0.8231142857142857,8.84
