Date,User,Tweet,Retweets,Likes,Followers,Tweet_original,polarity_score,Classification,Stance_-1to1,Stance_weighted_reach_-1to1,Stance_weighted_0to100
2024-08-30 12:09:38+00:00,2904867267,take read article provides broad overview ai history current capability ill discus ai could improve current crypto currency landscape aggregation pushing boundary polygonchain cdk web3 httpstcocgygvcsbij,0,0,611,"Take a read! This article provides a broad overview of AI's history and current capabilities. I'll then discuss how AI could improve the current crypto currency landscape while aggregation is pushing the boundaries.
#PolygonChain #CDK #web3

https://t.co/CGygVcsbIJ",0.0258,Capabilities,0.0258,0.025757911908646004,51.29
2024-08-30 12:09:11+00:00,14651892,establishes framework u ai safety institute receive access major new model company prior following public release agreement enable collaborative research evaluate capability safety risk httpstcof5lbrbhbm4,0,0,20631,“establishes the framework for the U.S. AI Safety Institute to receive access to major new models from each company prior to and following their public release. The agreements will enable collaborative research on how to evaluate capabilities and safety risks...” https://t.co/f5lbrbhBm4,0.7717,Both,0.7717,0.771662598749576,88.58
2024-08-30 12:07:46+00:00,1664848886144417795,meet financial objective also align broader ethical sustainability goal conclusion ai llm tool significantly transformed investment landscape streamlining process enhancing decisionmaking capability providing deeper insight,0,0,8,"meet financial objectives but also align with broader ethical and sustainability goals.

In conclusion, AI and LLM tools have significantly transformed the investment landscape by streamlining processes, enhancing decision-making capabilities, and providing deeper insights into",0.5106,Both,0.5106,0.45954,72.98
2024-08-30 12:07:32+00:00,1664848886144417795,enhanced capability natural language processing ai tool capable generating sophisticated explanation investment strategy market condition improves communication financial analyst portfolio manager client leading,0,0,8,"enhanced capabilities for natural language processing, AI tools are now capable of generating more sophisticated explanations for investment strategies or market conditions. This improves communication between financial analysts, portfolio managers, and clients, leading to",0.8885,Capabilities,0.8885,0.7996499999999999,89.98
2024-08-30 12:07:04+00:00,1664848886144417795,ai language model llm tool investment process today rapidly evolving financial landscape ai llm technology increasingly integrated investment strategy enhance decisionmaking capability automate routine task provide deeper,0,0,8,"AI and Language Model (LLM) Tools in Investment Processes

In today's rapidly evolving financial landscape, AI and LLM technologies are increasingly being integrated into investment strategies to enhance decision-making capabilities, automate routine tasks, and provide deeper",0.0,Capabilities,0.0,0.0,50.0
2024-08-30 12:06:33+00:00,1749866354155380736,newsom stay chummy big tech veto artificial intelligence regulation opinion yahoo news canada httpstcoxjdvfa4twz ai artificialintelligence,0,0,44,Will Newsom stay chummy with Big Tech and veto artificial intelligence regulation? | Opinion - Yahoo News Canada https://t.co/XjdvFa4TWZ #ai #artificialintelligence,0.4767,Capabilities,0.4767,0.4663369565217392,73.32
2024-08-30 12:06:05+00:00,254081099,check semarchys collaboration microsoft azure semarchy leader master data management teaming azure purview revolutionize data governance read full blog learn httpstcopjfhvir14x httpstcotp0vtcenpz,0,0,2220,"Check out Semarchy's collaboration with Microsoft Azure! Semarchy, a leader in master data management, is teaming up with Azure Purview to revolutionize data governance.

Read the full blog to learn more: https://t.co/PJfhViR14x https://t.co/Tp0vtcenpz",0.0,Both,0.0,0.0,50.0
2024-08-30 12:05:27+00:00,1427483982296502273,aiwayfinder enables caching prime token bootstrap early community governance contributing growth ai agent ecosystem protocol exchange allocation prompt httpstcok2vg8xesmt,0,4,15193,".@AIWayfinder enables the caching of $PRIME tokens to bootstrap the early community and governance, contributing to the growth of its AI agents ecosystem and protocol, in exchange for an allocation of $PROMPT.

https://t.co/K2VG8Xesmt",0.3818,Both,0.3818,0.38177487331358995,69.09
2024-08-30 12:03:32+00:00,1577241403,dont know people keep tweet airfryers eu regulation ai photo video airconditioning id go crazy unfollow already,3,439,511258,"I don't know how you people keep up

Tweets about airfryers then EU regulation then AI photos and videos then airconditioning

I'd go crazy and unfollow myself already",-0.34,Neither,-0.34,-0.3399998337438394,33.0
2024-08-30 12:02:31+00:00,188101003,could design new form artificial intelligence complement human intelligence perfectly capability would might ai partner enhance human potential,0,0,12,"If you could design a new form of artificial intelligence that complements human intelligence perfectly, what capabilities would it have? How might this AI partner enhance human potential?",0.886,Capabilities,0.886,0.8227142857142857,91.14
2024-08-30 12:02:01+00:00,594587570,let u guide harnessing adobe experience platform aep capability meet today high customer expectation realtime hyperpersonalized experience learn httpstcoyczt5mj8j6 cx ai personalization,0,0,1820,"Let us guide you through harnessing @Adobe Experience Platform’s (AEP) capabilities to meet today’s high customer expectations with real-time, hyper-personalized experiences 🔥

Learn more now: https://t.co/YCzT5Mj8J6

#CX #AI #Personalization",0.0,Capabilities,0.0,0.0,50.0
2024-08-30 12:01:21+00:00,975644222484307969,robot dog dodge danger enhanced ai capability 83024 defiance daily httpstcok3hxkrhnop,0,0,2056,Robot Dog to “Dodge” Dangers with Enhanced AI Capabilities - 8.30.24 - DeFiance Daily https://t.co/k3hXKrHnoP,-0.5267,Capabilities,-0.5267,-0.52644407191448,23.68
2024-08-30 12:01:16+00:00,1703154202380267520,chain_gpt awesome cgpt key component chaingpt ecosystem enabling access ai tool providing equity governance opportunity fostering community engagement,0,1,33,"@Chain_GPT Awesome, $CGPT is a key component of the #chainGPT ecosystem, enabling access to AI tools, providing equity and governance opportunities, and fostering community engagement.",0.872,Safety,-0.872,-0.8470857142857143,7.65
2024-08-30 12:00:55+00:00,1767674564786708480,45 invest ai literacy upskill team ai tool technology enhance marketing capability encourage experimentation handson experience reveal surprising insight maximizing ai efficiency aimarketing pallasadvisory,0,0,145,"4/5 📚 Invest in AI literacy. Upskill your team on AI tools and technologies to enhance your marketing capabilities. Encourage experimentation, as hands-on experience can reveal surprising insights into maximizing AI efficiency. #AIMarketing #PallasAdvisory",0.7845,Capabilities,0.7845,0.7791632653061225,88.96
2024-08-30 12:00:41+00:00,1812967624831344644,artificial intelligence ai pushing boundary robotics enhancing capability healthcare aipowered robot improving accuracy surgical procedure accelerating recovery time patient creating positive experience httpstcocyq48ql6ac,0,0,0,"Artificial intelligence (AI) is pushing the boundaries of robotics, and enhancing capabilities in healthcare. AI-powered robots are improving accuracy in surgical procedures and accelerating recovery times for patients, creating a more positive experience. https://t.co/cYQ48ql6Ac",0.8934,Capabilities,0.8934,0.4467,72.33
2024-08-30 12:00:30+00:00,732122239290736640,take gander day unfolded team e42 14thsharedservicessummit ubsforums keynote paneldiscussions insight galore looking forward opportunity showcase e42s capability know httpstcovtmrhy4bae httpstcowpvcdnr1j6,0,0,154,"Take a gander at how the day unfolded for Team #E42 at the #14thSharedServicesSummit by @ubsforums. #Keynotes, #paneldiscussions, and insights galore! Looking forward to more opportunities to showcase E42’s capabilities.

Know more: https://t.co/vTMRHy4baE https://t.co/WpvCDnR1j6",0.4215,Capabilities,0.4215,0.41879807692307697,70.94
2024-08-30 12:00:04+00:00,27707859,regulating uncertainty governance option generativeai report analyzes existing array proposal governance generative ai author flogsell read full paper httpstcon0akkhwnxu httpstcomc0uwh3nuh,3,4,27607,"Regulating under Uncertainty: Governance Options for #GenerativeAI

This report analyzes the existing array of proposals for #governance of generative #AI.

Author: @flogsell

Read the full paper: https://t.co/N0AkkHWNxU https://t.co/Mc0Uwh3nUh",-0.34,Both,-0.34,-0.3399969212101456,33.0
2024-08-30 12:00:04+00:00,3131760359,looking enhance ai strategy insightful guide mckinsey scaling generative ai share leverage data drive innovation growth ai datastrategy genai cdo httpstcogsqnontyr5,0,0,43,Looking to enhance your AI strategy? This insightful guide from McKinsey on scaling Generative AI shares how to leverage data to drive innovation and growth. #AI #DataStrategy #GenAI #CDO https://t.co/GSQNonTYR5,0.7506,Capabilities,0.7506,0.73392,86.7
2024-08-30 12:00:01+00:00,1925927425,generative ai capability profound impact various industry including information technology httpstcom8p6ko7iya,0,0,21404,"Generative AI capabilities are having a profound impact on various industries, including information technology.
https://t.co/m8p6Ko7IyA",0.0,Capabilities,0.0,0.0,50.0
2024-08-30 12:00:00+00:00,1671555700374360064,learn elon musk endorsement california ai regulation bill called tough call thoughtprovoking blog post stay informed latest tech development read httpstco6uaijtvvaa,0,0,233,Learn about Elon Musk's endorsement of the California AI regulation bill and why he called it a 'tough call' in this thought-provoking blog post. Stay informed about the latest tech developments. Read more here: https://t.co/6UaiJtVVaA,0.2023,Neither,0.2023,0.2014391489361702,60.07
2024-08-30 11:59:18+00:00,1578458844640038922,2 nvda unveiled latest chip designed push boundary technological performance efficiency gt chip incorporate advanced ai machine learning capability promise deliver unprecedented speed processing power httpstcoxyuag1oxos,0,0,5168,"2/ $NVDA unveiled its latest chips designed to push the boundaries of technological performance and efficiency.

&gt; These chips, which incorporate advanced AI and machine learning capabilities, promise to deliver unprecedented speeds and processing power.
 https://t.co/xyUag1oxOs",0.7845,Capabilities,0.7845,0.784348259187621,89.22
2024-08-30 11:57:28+00:00,1584506176078848000,control ai brunch deepminds first policy chief verity harding siftedeu ai deepmind regulation technology policy httpstconrntuteuqx,0,0,118,"“We can control AI” — Brunch with DeepMind’s first policy chief, Verity Harding

@Siftedeu #AI #DeepMind #regulation #technology #policy 

https://t.co/NRntutEUQX",0.0,Capabilities,0.0,0.0,50.0
2024-08-30 11:56:02+00:00,1322075523820982273,ceo carolinecarrut8 featured itpros latest article discussing ai legislation approved california lawmaker week check full article httpstcoruaqru9goh,1,1,196,"Our CEO, @CarolineCarrut8 has been featured in @ITPro's latest article discussing the AI legislation approved by California lawmakers this week.

Check out the full article here: https://t.co/rUaqRU9GOh",0.4215,Neither,0.4215,0.420432911392405,71.02
2024-08-30 11:55:58+00:00,1529529760161865734,microsoft azure powerful tool building modern application service ready explore capability share plan comment microsoftazure cloudcomputing tech cloud azure data ai security posterumsoft visit website httpstco4zpj3kbadx,0,0,109,"Microsoft Azure is a powerful tool for building modern applications and services.
Ready to explore its capabilities? Share your plans in the comments! 👇

#MicrosoftAzure #CloudComputing #IT #Tech #Cloud #Azure #Data #AI #Security #PosterumSoft

Visit our website:… https://t.co/4ZpJ3kbADX",0.836,Capabilities,0.836,0.8284684684684686,91.42
2024-08-30 11:55:00+00:00,2561631212,ready revolutionize business ai dont miss expanding ai impact webinar collaboration bainsight learn top expert enhance copilot azure ai service register lead change httpstconixgb1axjp ai azure,0,0,799,"Ready to revolutionize your business with AI? Don't miss the ""Expanding AI Impact"" webinar in collaboration with @BAinsight! Learn from top experts how to enhance Copilot with Azure AI services. Register now and lead the change!

🔗https://t.co/nixGb1AxJp 

 #AI #Azure",0.5781,Capabilities,0.5781,0.577378277153558,78.87
2024-08-30 11:54:27+00:00,1727495521739091969,introducing stalwart ai revolutionizing blockchain digital asset management stalwart ai groundbreaking ai module transforming blockchain digital asset landscape cuttingedge analysis capability stalwartai blockchain zealy httpstcoufzodyocfz,0,1,183,"Introducing Stalwart AI,
Revolutionizing Blockchain and Digital Asset Management. Stalwart AI is a groundbreaking AI module transforming the blockchain and digital asset landscape! With its cutting-edge analysis capabilities! #StalwartAi #Blockchain #Zealy https://t.co/UFZOdYOCfZ",0.6124,Capabilities,0.6124,0.6090897297297299,80.45
2024-08-30 11:52:43+00:00,1701263040673660928,binance support cardanos network upgrade cardano network ready chang hard fork part transition voltaire era decentralized network governance norque noq bitcoin eth ai blockchain,0,2,2655,"Binance to support Cardano’s network upgrade  

The Cardano network is ready for the Chang hard fork, part of the transition to the Voltaire era of decentralized network governance.

#Norque #NOQ #Bitcoin #ETH #AI #Blockchain",0.5859,Safety,-0.5859,-0.5856794881445239,20.72
2024-08-30 11:51:44+00:00,1782581362517495809,ai beginningoftheend humanrace humanextinction debate expert futurist ethicist potentialrisks aidevelopment governance integration society riskvsbenefit technology futureuse httpstcobyrn3zrvuq,0,0,154,#AI #BeginningOfTheEnd #HumanRace #HumanExtinction #Debate #Experts #Futurists #Ethicists #PotentialRisks #AIDevelopment #Governance #Integration #Society #RiskVsBenefit #Technology #FutureUse https://t.co/byrn3ZRvuQ,0.0,Both,0.0,0.0,50.0
2024-08-30 11:51:00+00:00,739752670752346112,rt nafisalam historical analogue inform aigovernancerandcorporation bigdata artificalintelligence ai aiethics aibias,6,0,44869,"RT @nafisalam: Historical Analogues That Can Inform #AIGovernance-@RANDCorporation 

#Bigdata #artificalintelligence #AI #AIEthics #AIbias…",0.0,Both,0.0,0.0,50.0
2024-08-30 11:49:09+00:00,21424048,artificial intelligence trend continue drive innovation enhancing software capability influencing human activity across business culture httpstconwp9p5p3mv,0,0,1003,Artificial intelligence trends continue to drive the innovations enhancing software capabilities and influencing human activities across business and culture. https://t.co/NWp9P5P3mv,0.6908,Capabilities,0.6908,0.6901126368159204,84.51
2024-08-30 11:49:05+00:00,1693390629261205504,way create interact digital entity revolutionised matrix governance engagement join decentralised environment influence development ai future,0,0,319,The way we create and interact with digital entities is being revolutionised by $MATRIX from governance to engagement. Join a decentralised environment where you can influence the development of AI in the future.,0.743,Both,0.743,0.7406853582554517,87.03
2024-08-30 11:48:18+00:00,16258206,juleshyman honorable japan focus ai swarm logic operation ai thrives intelligent clustered military action ai military equipment performs better hive mode enabling soldier optimal capability almost military theater command action httpstco39ehxx9ogf,0,0,55,@juleshyman Honorable Japan: Focus On “AI Swarm Logic” Operations: AI thrives and is more intelligent in clustered military actions. AI military equipment performs better in “Hive Mode” enabling your soldiers optimal capabilities in almost all military theater command actions.🙂 https://t.co/39EhXX9OgF,0.8979,Capabilities,0.8979,0.8821473684210527,94.11
2024-08-30 11:45:04+00:00,839305949290594309,matter development suggest apple investing heavily artificial intelligence future product apple potential investment openai could significantly impact ai capability,0,0,1006,Why it matters: These developments suggest Apple is investing heavily in artificial intelligence and its future products. Apple's potential investment in OpenAI could significantly impact its AI capabilities.,0.4939,Capabilities,0.4939,0.49341001984126986,74.67
2024-08-30 11:42:42+00:00,4341007829,yuku yukus innovative approach combine ai technology nft integration providing truly unique user experience intelligent ai avatar decentralized governance model make standout platform web3 space blending advanced ai user control httpstcoqc2tssb2z1,0,0,112185,"🔍 Why Yuku?
Yuku's innovative approach combines AI technology with NFT integration, providing a truly unique user experience. The intelligent AI Avatars and decentralized governance model make it a standout platform in the Web3 space. By blending advanced AI with user control,… https://t.co/qc2tsSb2Z1",0.8689,Both,0.8689,0.8688922548958435,93.44
2024-08-30 11:40:15+00:00,1479453155557462022,rejuve_ai aubreydegrey adaptive riskbased regulation may necessary innovation thrive without compromising safety compliance role think collaboration play shaping future longevity research rejuve_ai,0,0,298,@Rejuve_AI @aubreydegrey Adaptive and risk-based regulation may be necessary for innovation to thrive without compromising safety and compliance. What role do you think this collaboration will play in shaping the future of longevity research? @Rejuve_AI,0.3956,Both,0.3956,0.3942813333333334,69.71
2024-08-30 11:39:20+00:00,1479453155557462022,rejuve_ai aubreydegrey think communitydriven innovation great potential drive progress longevity research however collaboration innovator regulator community key strike balance regulation,0,0,298,"@Rejuve_AI @aubreydegrey I think community-driven innovation has great potential to drive progress in longevity research. However, collaboration between innovators, regulators, and the community is key to strike a balance with regulation.",0.8402,Capabilities,0.8402,0.8373993333333333,91.87
2024-08-30 11:38:56+00:00,1687424446812786690,gavinelwes certainly impactful day ai becomes lifelike output simple prompt guess ultimately regulation need implemented requires watermark sort image video indicate ai generated similar httpstcorrkppica8h,1,3,4200,"@GavinElwes It’s certainly impactful how each day AI becomes more and more lifelike on its output from simple prompts. 

Our guess is that ultimately a regulation will need to be implemented that requires a watermark of sorts on the image or video to indicate it was AI generated.  

Similar… https://t.co/rrkPPiCa8h",0.34,Neither,0.34,0.3399595382601452,67.0
2024-08-30 11:35:47+00:00,1822661852628910080,cryptoking053 nobodypro_ai decentralized governance point,0,0,1,@CryptoKing053 @Nobodypro_AI Decentralized governance on point! 🏛️,0.0,Safety,0.0,0.0,50.0
2024-08-30 11:35:23+00:00,75190893,prezidentpavel state regulation ai needed potential negative impact humanity globsec2024,0,0,9313,.@prezidentpavel states regulation of AI needed as it has potential to have a negative impact on all of humanity #globsec2024,-0.5719,Neither,-0.5719,-0.5718386044015028,21.41
2024-08-30 11:34:57+00:00,1810268239626461184,discover california ai regulation bill paving way safe innovation world artificial intelligence groundbreaking legislation aim balance technological progress ethical consideration ensuring transparency ac httpstconlgnssywyu,0,0,2,"Discover how California's AI Regulation Bill is paving the way for safe innovation in the world of artificial intelligence. This groundbreaking legislation aims to balance technological progress with ethical considerations, ensuring transparency and ac...
https://t.co/NLGNsSYwYu",0.9413,Both,0.9413,0.705975,85.3
2024-08-30 11:33:35+00:00,1766159440594825216,tweet 28 neurochainai neurochainai revolutionary project combining blockchain technology advanced ai capability focus decentralization efficiency transform use blockchain across various sector,0,1,38,"Tweet 2/8
🚀 What is @NeurochainAI?
NeurochainAI is a revolutionary project combining blockchain technology with advanced AI capabilities. It focuses on decentralization and efficiency to transform how we use blockchain across various sectors.",0.5423,Capabilities,0.5423,0.5287425,76.44
2024-08-30 11:33:20+00:00,1504090654862938112,california ai bill attracts famous critic supporter httpstcoigmbhav2br,0,0,82,"California AI Bill Attracts Famous Critics, Supporters https://t.co/igmBhaV2BR",0.4019,Neither,0.4019,0.3971154761904762,69.86
2024-08-30 11:32:53+00:00,1352326505527971840,vamc_marketing whats exciting ai trend youre seeing httpstcogmpjbvvma0,0,0,5638,@VAMC_Marketing What’s the most exciting AI trend you’re seeing? https://t.co/gmpJBvVMa0,0.4939,Neither,0.4939,0.49381242907801415,74.69
2024-08-30 11:31:30+00:00,1675521239182393344,48start clear business objective understand ai capability limitation begin small pilot project scale gradually leveraging mentor advisor guidance httpstcojjkzrgnor4,0,0,12,"(4/8)🎯Start with clear business objectives and understand AI's capabilities and limitations. Begin with small pilot projects and scale up gradually, leveraging mentors and advisors for guidance. https://t.co/jjKzRGNOr4",0.1027,Capabilities,0.1027,0.09536428571428572,54.77
2024-08-30 11:30:40+00:00,1826349652901273600,aigiganten openai en anthropic geven de v overheid exclusieve toegang voor doemscenariotests dit een stap naar veiligheid controle ai tech httpstco5gb7vfxvbr,0,0,22,AI-giganten OpenAI en Anthropic geven de VS overheid exclusieve toegang voor doemscenario-tests! Is dit een stap naar veiligheid of controle? 🤖💥 #AI #Tech https://t.co/5GB7VFxvbr,0.0,Neither,0.0,0.0,50.0
2024-08-30 11:30:22+00:00,1591085112871030784,44 spark informed ai ethic governance discussion fueling deeper insight responsible decision everevolving world artificial intelligence,0,0,514,"4/4 It sparks informed AI ethics and governance discussions, fueling deeper insights and responsible decisions in the ever-evolving world of artificial intelligence.",0.743,Both,0.743,0.7415600775193798,87.08
2024-08-30 11:30:18+00:00,184813842,california pass groundbreaking ai regulation setting safety standard largescale ai model ai tech innovation regulation,0,0,506,"California passes groundbreaking AI regulation, setting safety standards for large-scale AI models. #AI #Tech #Innovation #Regulation",0.6597,Both,0.6597,0.6584013779527559,82.92
2024-08-30 11:30:02+00:00,32588433,major concern ai capability ai might overshadow human role seo current limitation ai might case fact case ai enhances replace human seo strategy httpstcoqurg9hiit7 seonews,0,0,389,"A major concern about AI's capabilities is that AI might overshadow human roles in #SEO. But, with the current limitations of AI, this might not be the case.

In fact, in some cases, AI enhances, but does not replace, human SEO strategies.

More: https://t.co/QURg9HIIt7

#SEONews",-0.296,Capabilities,-0.296,-0.29524296675191813,35.24
2024-08-30 11:27:20+00:00,3321203251,shri anil kumar lahoti chairman trai senior officer staff trai attending workshop ai framework governance application conducted m ericsson 28th august 2024 trai hq httpstcoivijgf3tya,2,7,350189,"Shri Anil Kumar Lahoti, Chairman, TRAI with senior officers and staff of TRAI attending the workshop on ""AI Framework, Governance and Applications"" conducted by M/S Ericsson on 28th August 2024 at TRAI HQ. https://t.co/IVijGF3TYa",0.0,Safety,0.0,0.0,50.0
2024-08-30 11:26:56+00:00,981897048701235200,libshipwreck popaff required ai policy course syllabus student writing skill trending career amp ai make matter worse,2,13,21532,@libshipwreck @popaff We are now required to have an AI policy in our course syllabi. Students’ writing skills have been trending down during my career &amp; AI only makes matters worse.,-0.4588,Neither,-0.4588,-0.45879289783281735,27.06
2024-08-30 11:26:38+00:00,862279519,daveshapi there answer natural system posse principle selforganization maintain selfregulation maximum efficiency minimum cost inherently benevolent overall system ai need mimic natural system,0,0,256,"@DaveShapi Theres an answer. 
All natural systems possess the principles of self-organization, which maintain self-regulation, maximum efficiency at a minimum cost, and inherently benevolent to the overall system.  
AI needs to mimic natural systems.",0.8807,Capabilities,0.8807,0.8772864341085271,93.86
2024-08-30 11:25:35+00:00,1596267596738953217,poooadi share privacy policy remaker ai httpstcoolncsdb3qd,0,0,8,poooAdi Share: Privacy Policy Remaker AI https://t.co/oLnCsDB3qd,0.296,Neither,0.296,0.26639999999999997,63.32
2024-08-30 11:25:07+00:00,877441709256445953,fed get early access openai anthropic ai test doomsday scenario httpstcowpvmlsae1b httpstcorp0unftgrw,0,0,6847,"Feds to get early access to OpenAI, Anthropic AI to test for doomsday scenarios https://t.co/WpVMLsAE1B https://t.co/rP0unftGrw",-0.5859,Neither,-0.5859,-0.5858144546649146,20.71
